{"blobItems":[{"blobToken":"cjJqR2M5MHBNbGY5bnkyRFJVbHlYeWpUbHBDQXpVSXVFSFZETU5KS1JVNmRBTHFseUYvckI0TnpUdDc4cVcwWFhKUUUwYktEeUhRV0t2RTVvM1VjSjBPVlhTek5ia2ZuZlRiZW1wQngxZ0FURUpQbDZBaW1VSlVSQ2RmM01JOXV2d0lNYmVDWUNxV01mQlhGRVN2YzJkSHRKT3BPTGlkaXdHZnd5T285S1Y0aElOdnF2RmNFSHdFWnR6MW5PMk5qS3VkVG9ybUFkM2htYm1oNkVUK2x0cDJLYW5icVRUcE12NW9jNXlGcytOeHpwdEdNNnBGck4yU25CTGhCaDcrMG81VlZLOWFSVmptVFNsaE94UXJtaVE9PQ%3D%3D","name":"rapid_response/warn_documents/2025/Edgewell Personal Care\u0027s Schick (Milford) 11-13-2025.pdf","modifiedDate":"2025-11-13T20:51:37+00:00","blobProperties":{"warn_document_date":"2025-11-13","warn_document_received_date":"2025-11-13","affected_company":"Edgewell Personal Care/Schick","number_of_impacted_workers":"293","layoff_locations__":"Milford","layoff_dates":"3/2/2026 - 12/31/2027","closing_dates_":"12/31/2027","union":"N/A"}},{"blobToken":"cjJqR2M5MHBNbGY5bnkyRFJVbHlYeWpUbHBDQXpVSXVFSFZETU5KS1JVNmRBTHFseUYvckI0TnpUdDc4cVcwWFhKUUUwYktEeUhRV0t2RTVvM1VjSjBPVlhTek5ia2ZuZlRiZW1wQngxZ0FURUpQbDZBaW1VSlVSQ2RmM01JOXV2d0lNYmVDWUNxV01mQlhGRVN2YzJZTENhQ0t0cldJZG9aMFRMNFJ2cC9DaUlwbXduRzRRZStCaWRsV2c5R3lHb0Z6S3R6Qk03R2x5VDVVNmJ1NFdOV2hTQ0hTOXREVUJVeGhnZm1XNzF1VG45aFNBRzZYUldXZVFOWCtYVnZRMWl1OC8vV3FYcGRzWXZQb2dJQTh4dTdVeXN4YkxQZi82TUZwdG5vWXNFeHczZEFra1NpMERyYVZLQUhvMkNJcFM%3D","name":"rapid_response/warn_documents/2025/Metallics, Inc. subsidiary of NSI Industries, LLC (Bristol) 11-7-2025.pdf","modifiedDate":"2025-11-10T17:28:29+00:00","blobProperties":{"warn_document_date":"2025-11-07","warn_document_received_date":"2025-11-07","affected_company":"Metallics, Inc","number_of_impacted_workers":"33","layoff_locations__":"Bristol","layoff_dates":"5/1/2026 - 9/30/2026","closing_dates_":"9/30/2026","union":"N/A"}},{"blobToken":"cjJqR2M5MHBNbGY5bnkyRFJVbHlYeWpUbHBDQXpVSXVFSFZETU5KS1JVNmRBTHFseUYvckI0TnpUdDc4cVcwWFhKUUUwYktEeUhRV0t2RTVvM1VjSjBPVlhTek5ia2ZuZlRiZW1wQngxZ0FURUpQbDZBaW1VSlVSQ2RmM01JOXV2d0lNYmVDWUNxV01mQlhGRVN2YzJicU81VFFpQVc4blp3Y3ExcWdFRnJyS21uN0hINzlLcGMwcXU3V0QxYjUrd29yRUxJTDJ2ckZhZHZJVU1hTmZQTTZITHBKMlJrQ0tlamMyOG84bWRrY0RFeGZVQ281R2taVWdKWFJKdmZGSA%3D%3D","name":"rapid_response/warn_documents/2025/ELG Utica Alloys (Hartford) 10-31-2025.pdf","modifiedDate":"2025-11-03T13:51:22+00:00","blobProperties":{"warn_document_date":"2025-10-31","warn_document_received_date":"2025-10-31","affected_company":"ELG Utica Alloys (Harford), Inc.","number_of_impacted_workers":"51","layoff_locations__":"Hartford","layoff_dates":"12/31/2025","union":"Yes","union_address":"Not Provided","title":"Not Provided"}},{"blobToken":"cjJqR2M5MHBNbGY5bnkyRFJVbHlYeWpUbHBDQXpVSXVFSFZETU5KS1JVNmRBTHFseUYvckI0TnpUdDc4cVcwWFhKUUUwYktEeUhRV0t2RTVvM1VjSjBPVlhTek5ia2ZuZlRiZW1wQngxZ0FURUpQbDZBaW1VSlVSQ2RmM01JOXV2d0lNYmVDWUNxV01mQlhGRVN2YzJWckQ5TkNuV1FzSHZSRWFrTTk4dUlDb0YzdmExeWM5UGxuTGh6c3diaEx6SFczYXFCRElsVVFOeUk4d1lKTGo1MmJIOVVXS0NPaE4wdHEycW1BSkdNcWVSVHpma09rdjRXaC8vbjNLWUdBWTFsY2IvdHBERjlZTnN0QUxMM1JxL0VRb2VxQWdrWlMzYzBWOVB6MTNpa1k9","name":"rapid_response/warn_documents/2025/Macy\u0027s Distribution Center (South Windsor) 10-28-2025_OCR.pdf","modifiedDate":"2025-11-04T16:21:53+00:00","blobProperties":{"warn_document_date":"2025-10-28","warn_document_received_date":"2025-10-28","affected_company":"Macys South Windsor Distribution Center","number_of_impacted_workers":"106","layoff_locations__":"South Windsor","layoff_dates":"12/28/2025","closing_dates_":"12/28/2025"}},{"blobToken":"cjJqR2M5MHBNbGY5bnkyRFJVbHlYeWpUbHBDQXpVSXVFSFZETU5KS1JVNmRBTHFseUYvckI0TnpUdDc4cVcwWFhKUUUwYktEeUhRV0t2RTVvM1VjSjBPVlhTek5ia2ZuZlRiZW1wQngxZ0FURUpQbDZBaW1VSlVSQ2RmM01JOXV2d0lNYmVDWUNxV01mQlhGRVN2YzJWc3Y2NWFodnN6UkdSeEdMTUR1bDg3RTRSQVE2T3VBUzZxbVh4WVkzYlpVQjlLSWN5UFFZdkVGL05IZ3hwZmw4cGUxYTVsQjY4cEtmMEFOWkk1S0czMD0%3D","name":"rapid_response/warn_documents/2025/Balducci\u0027s (Westport) 10-24-2025.pdf","modifiedDate":"2025-10-27T13:21:55+00:00","blobProperties":{"warn_document_date":"2025-10-24","warn_document_received_date":"2025-10-24","affected_company":"Baduccis","number_of_impacted_workers":"59","layoff_locations__":"Westport","layoff_dates":"2/28/2026","closing_dates_":"2/28/2006"}},{"blobToken":"cjJqR2M5MHBNbGY5bnkyRFJVbHlYeWpUbHBDQXpVSXVFSFZETU5KS1JVNmRBTHFseUYvckI0TnpUdDc4cVcwWFhKUUUwYktEeUhRV0t2RTVvM1VjSjBPVlhTek5ia2ZuZlRiZW1wQngxZ0FURUpQbDZBaW1VSlVSQ2RmM01JOXV2d0lNYmVDWUNxV01mQlhGRVN2YzJZMWZUVFhTYUVaV0lrc3AzamV2U0tTUmV2cFN1OHdqUytoUWVES0hzYndmWFNBTlZyWk9wZWJBNjVubG5OdXJSKzExV3BEWGFYdkRPeDQyQThyZi9pTT0%3D","name":"rapid_response/warn_documents/2025/PosiGen (Shelton) 10-24-2025.pdf","modifiedDate":"2025-10-27T13:34:04+00:00","blobProperties":{"warn_document_date":"2025-10-24","warn_document_received_date":"2025-10-24","affected_company":"PosiGen Developer LLC","number_of_impacted_workers":"Not provided","layoff_locations__":"Shelton","layoff_dates":"11/2/2025","closing_dates_":"11/2/2025"}},{"blobToken":"cjJqR2M5MHBNbGY5bnkyRFJVbHlYeWpUbHBDQXpVSXVFSFZETU5KS1JVNmRBTHFseUYvckI0TnpUdDc4cVcwWFhKUUUwYktEeUhRV0t2RTVvM1VjSjBPVlhTek5ia2ZuZlRiZW1wQngxZ0FURUpQbDZBaW1VSlVSQ2RmM01JOXV2d0lNYmVDWUNxV01mQlhGRVN2YzJjNlNnTGt5bklvZlgrZG1HM3JBdHBYaW04R20zeXE2OSs2U0NRb0pvYVVTdFhHbVFLZnF4WEQybm9hQzdYK2RKRkJCSmk4L0hRZ0VwR3N3akc2bmw1WmlzdFZ0V3BvTWhZWVZqU0VIVUxzSw%3D%3D","name":"rapid_response/warn_documents/2025/CVS Health (Hartford-remote) 10-17-2025.pdf","modifiedDate":"2025-10-20T11:55:19+00:00","blobProperties":{"warn_document_date":"2025-10-17","warn_document_received_date":"2025-10-17","affected_company":"CVS Health","number_of_impacted_workers":"72","layoff_locations__":"Remote","layoff_dates":"12/31/2025","closing_dates_":"N/A","union":"N/A"}},{"blobToken":"cjJqR2M5MHBNbGY5bnkyRFJVbHlYeWpUbHBDQXpVSXVFSFZETU5KS1JVNmRBTHFseUYvckI0TnpUdDc4cVcwWFhKUUUwYktEeUhRV0t2RTVvM1VjSjBPVlhTek5ia2ZuZlRiZW1wQngxZ0FURUpQbDZBaW1VSlVSQ2RmM01JOXV2d0lNYmVDWUNxV01mQlhGRVN2YzJjRlVuUzBIaTZuRmc2TUg3VGZQV3Rnczc4bW5QelN1U0Fncm45cTZFMnBMVnF2dDlJcXJQWk1tR1daZmRBL3NzWVRQMzh6QStWeFNRNlI0T1JIaUJlST0%3D","name":"rapid_response/warn_documents/2025/ImageFIRST (Farmington) 10-9-2025.pdf","modifiedDate":"2025-10-10T18:46:37+00:00","blobProperties":{"warn_document_date":"2025-10-09","warn_document_received_date":"2025-10-09","affected_company":"ImageFIRST Healthcare Laundry Specialists, LLC","number_of_impacted_workers":"69","layoff_locations__":"12/08/2025","layoff_dates":"12/08/2025"}},{"blobToken":"cjJqR2M5MHBNbGY5bnkyRFJVbHlYeWpUbHBDQXpVSXVFSFZETU5KS1JVNmRBTHFseUYvckI0TnpUdDc4cVcwWFhKUUUwYktEeUhRV0t2RTVvM1VjSjBPVlhTek5ia2ZuZlRiZW1wQngxZ0FURUpQbDZBaW1VSlVSQ2RmM01JOXV2d0lNYmVDWUNxV01mQlhGRVN2YzJUZTdzUzVGa3JnUmNMTVZYUTFxbU5DdlFNU1E4Yldjc1ZkT3BmUktuaTYra1owbGJvMEFOTitLbExmOGxHeUFCNm9BUlJ0MjdHeFBRUG0wZi9USlg5Y01uby9KNTVzUDdMT0ozYnFHTGFVTWJlV2RDSUZxSVIvS3NORXBldW9aZmc9PQ%3D%3D","name":"rapid_response/warn_documents/2025/Posigen (Shelton, Danbury, Wethersfield) 10-3-2025.pdf","modifiedDate":"2025-10-06T20:09:41+00:00","blobProperties":{"warn_document_date":"2025-10-03","warn_document_received_date":"2025-10-03","affected_company":"PosiGen Developer LLC","number_of_impacted_workers":"Not indicated","layoff_locations__":"Shelton, Danbury, Wethersfield","layoff_dates":"10/12/2025 - 10/25/2025","closing_dates_":"10/25/2025","union":"N/A"}},{"blobToken":"cjJqR2M5MHBNbGY5bnkyRFJVbHlYeWpUbHBDQXpVSXVFSFZETU5KS1JVNmRBTHFseUYvckI0TnpUdDc4cVcwWFhKUUUwYktEeUhRV0t2RTVvM1VjSjBPVlhTek5ia2ZuZlRiZW1wQngxZ0FURUpQbDZBaW1VSlVSQ2RmM01JOXV2d0lNYmVDWUNxV01mQlhGRVN2YzJUVVRUaVU4dStSVGpKNjcvRnlxNDREN1ZEQTlDM3ZHdUl5WlI1cWQxLytybWlMa3JNTVQxZ1BrYjVSUzRhQzc2azVzQlJkcUtZYnlLa1JDTWJyK3RVYz0%3D","name":"rapid_response/warn_documents/2025/SimplyIOA LLC (Remote) 10-3-2025.pdf","modifiedDate":"2025-10-08T19:18:39+00:00","blobProperties":{"warn_document_date":"2025-10-03","warn_document_received_date":"2025-10-07","affected_company":"SimplyIOA, LLC","number_of_impacted_workers":"66; #CT workers not indicated","layoff_locations__":"Remote","layoff_dates":"December 2, 2025","closing_dates_":"December 2, 2025","union":"No"}},{"blobToken":"cjJqR2M5MHBNbGY5bnkyRFJVbHlYeWpUbHBDQXpVSXVFSFZETU5KS1JVNmRBTHFseUYvckI0TnpUdDc4cVcwWFhKUUUwYktEeUhRV0t2RTVvM1VjSjBPVlhTek5ia2ZuZlRiZW1wQngxZ0FURUpQbDZBaW1VSlVSQ2RmM01JOXV2d0lNYmVDWUNxV01mQlhGRVN2YzJmNG41RElveFFDd01NVGM3NUpia01nRlE1SWt6SzQ5bHVsUDNSeFdKNTZ5NkZ1Y1I4Ykk3TFhWZTJ3cHVKNlVGcStTTnJndnRMRHJyN2ZVV1BHNmdpaz0%3D","name":"rapid_response/warn_documents/2025/Perkin Elmer (Shelton) 9-23-2025.pdf","modifiedDate":"2025-09-24T17:54:46+00:00","blobProperties":{"warn_document_date":"2025-09-23","warn_document_received_date":"2025-09-23","affected_company":"PerkinElmer U.S. LLC","number_of_impacted_workers":"68","layoff_locations__":"Shelton","layoff_dates":"11/24/2025 - 4/1/2026","closing_dates_":"4/1/2026","title":"PerkinElmer WARN"}},{"blobToken":"cjJqR2M5MHBNbGY5bnkyRFJVbHlYeWpUbHBDQXpVSXVFSFZETU5KS1JVNmRBTHFseUYvckI0TnpUdDc4cVcwWFhKUUUwYktEeUhRV0t2RTVvM1VjSjBPVlhTek5ia2ZuZlRiZW1wQngxZ0FURUpQbDZBaW1VSlVSQ2RmM01JOXV2d0lNYmVDWUNxV01mQlhGRVN2YzJUZTdzUzVGa3JnUmNMTVZYUTFxbU5DdlFNU1E4Yldjc1ZkT3BmUktuaTYra1owbGJvMEFOTitLbExmOGxHeUFCNm9BUlJ0MjdHeFBRUG0wZi9USlg5ZklHV3BZWnZzRk55ZjhXeGxpUHQ2dlNyUld5Y0lHMkVBaHNRYUdBc0t0cmc9PQ%3D%3D","name":"rapid_response/warn_documents/2025/Posigen (Shelton, Danbury, Wethersfield 9-12-2025.pdf","modifiedDate":"2025-09-15T14:34:12+00:00","blobProperties":{"warn_document_date":"2025-09-12","warn_document_received_date":"2025-09-12","affected_company":"PosiGen Developer LLC","number_of_impacted_workers":"Not provided","layoff_locations__":"Shelton, Danbury, Wethersfield","layoff_dates":"9/21/2025 - 10/4/2025","closing_dates_":"9/21/2025 - 10/4/2025","title":"PosiGen Supplemental WARN 9.12.25"}},{"blobToken":"cjJqR2M5MHBNbGY5bnkyRFJVbHlYeWpUbHBDQXpVSXVFSFZETU5KS1JVNmRBTHFseUYvckI0TnpUdDc4cVcwWFhKUUUwYktEeUhRV0t2RTVvM1VjSjBPVlhTek5ia2ZuZlRiZW1wQngxZ0FURUpQbDZBaW1VSlVSQ2RmM01JOXV2d0lNYmVDWUNxV01mQlhGRVN2YzJUZTdzUzVGa3JnUmNMTVZYUTFxbU5DdlFNU1E4Yldjc1ZkT3BmUktuaTYra1owbGJvMEFOTitLbExmOGxHeUFCNm9BUlJ0MjdHeFBRUG0wZi9USlg5ZXpnNTh6bXRIQzVuR2taZE1MK2JHTzljdXJqKzBubG81aWpLRG1naSs3alE9PQ%3D%3D","name":"rapid_response/warn_documents/2025/Posigen (Shelton, Danbury, Wethersfield) 8-25-2025.pdf","modifiedDate":"2025-08-25T17:02:05+00:00","blobProperties":{"warn_document_date":"2025-08-25","warn_document_received_date":"2025-08-25","affected_company":"PosiGen Developer LLC","number_of_impacted_workers":"78","layoff_locations__":"Shelton, Danbury, Wethersfield","layoff_dates":"August 24, 2024","title":"PosiGen Developer LLC"}},{"blobToken":"cjJqR2M5MHBNbGY5bnkyRFJVbHlYeWpUbHBDQXpVSXVFSFZETU5KS1JVNmRBTHFseUYvckI0TnpUdDc4cVcwWFhKUUUwYktEeUhRV0t2RTVvM1VjSjBPVlhTek5ia2ZuZlRiZW1wQngxZ0FURUpQbDZBaW1VSlVSQ2RmM01JOXV2d0lNYmVDWUNxV01mQlhGRVN2YzJWeUI3VTdPNGRMWkNYQy8vSmZaNUJSTUx3SXBFRzFoREw3bDY2emJudXd1YXA5WW42bGpkWHdPMGN2N0VaTHliS0ZNdjlpdTQ2VlVUQTlUMnV5NWc0NmRkQjdMOXAzN3BudWQxV1I2T09QNnRrWjIxRWx4OG1EVm1uTXdYdExCUk9WblJOSTNIN0dOMVdReG9hZUtZSTQxaDRrL3NoSktGR1FxNmxaTUFsaC8%3D","name":"rapid_response/warn_documents/2025/Hbr Trumbull, LLC dba St. Joseph\u0027s Center (Trumbull) 6-10-2025OCR.pdf","modifiedDate":"2025-08-19T13:23:31+00:00","blobProperties":{"warn_document_date":"2025-06-10","warn_document_received_date":"2025-06-10","affected_company":"HDR Trumbull, LLC dba St. Josephs Center","number_of_impacted_workers":"179","layoff_locations__":"6448 Main Street, Trumbull CT","layoff_dates":"June 10, 2025","closing_dates_":"8/9/2025"}},{"blobToken":"cjJqR2M5MHBNbGY5bnkyRFJVbHlYeWpUbHBDQXpVSXVFSFZETU5KS1JVNmRBTHFseUYvckI0TnpUdDc4cVcwWFhKUUUwYktEeUhRV0t2RTVvM1VjSjBPVlhTek5ia2ZuZlRiZW1wQngxZ0FURUpQbDZBaW1VSlVSQ2RmM01JOXV2d0lNYmVDWUNxV01mQlhGRVN2YzJXYTcwR1dHQzg1SGlvMmoyZVQrOFh0R1FCQWxxM0tBOVZEZzZFN0tpL1dRbWVJRWhQRGg0dFUzMFlwZzQ0RmZHSHBnb0JrekNWNmk3Y0hObDZaWFlQRTM0cGFSWS9vZVR5S01kai9ST0RyUy80WTJMRG5GZUlDVFp5ZktUZ05rV0E9PQ%3D%3D","name":"rapid_response/warn_documents/2025/Feeney Brothers Excavation LLC (Waterbury) 5-2-2025.pdf","modifiedDate":"2025-07-02T18:39:10+00:00","blobProperties":{"warn_document_date":"2025-05-02","warn_document_received_date":"2025-05-02","affected_company":"Feeney Brothers Excavation, LLC","number_of_impacted_workers":"8","layoff_dates":"5/2/2025","title":"Feeney Brothers Excavation, LLC"}},{"blobToken":"cjJqR2M5MHBNbGY5bnkyRFJVbHlYeWpUbHBDQXpVSXVFSFZETU5KS1JVNmRBTHFseUYvckI0TnpUdDc4cVcwWFhKUUUwYktEeUhRV0t2RTVvM1VjSjBPVlhTek5ia2ZuZlRiZW1wQngxZ0FURUpQbDZBaW1VSlVSQ2RmM01JOXV2d0lNYmVDWUNxV01mQlhGRVN2YzJieHY0bVl3YzNKZDJtdmJIcy85YSttMjVwOVp3aHMraXgwbDdraFRNWGRuRXZlb1lkUjZNTDBHSk9hc2pPMlVjRks4SndXM3JUM3lwMHpuOENlR05qTT0%3D","name":"rapid_response/warn_documents/2025/Arvinas (New Haven) 4-30-2025OCR.pdf","modifiedDate":"2025-08-19T13:17:54+00:00","blobProperties":{"warn_document_date":"2025-04-30","warn_document_received_date":"2025-04-30","affected_company":"Arvinas, Inc","number_of_impacted_workers":"128","layoff_locations__":"5 Science Park , New Haven CT","layoff_dates":"June 29, 2025","closing_dates_":"June 29, 2025"}},{"blobToken":"cjJqR2M5MHBNbGY5bnkyRFJVbHlYeWpUbHBDQXpVSXVFSFZETU5KS1JVNmRBTHFseUYvckI0TnpUdDc4cVcwWFhKUUUwYktEeUhRV0t2RTVvM1VjSjBPVlhTek5ia2ZuZlRiZW1wQngxZ0FURUpQbDZBaW1VSlVSQ2RmM01JOXV2d0lNYmVDWUNxV01mQlhGRVN2YzJXYTcwR1dHQzg1SGlvMmoyZVQrOFh0R1FCQWxxM0tBOVZEZzZFN0tpL1dRSThWdVovYmpCVlFkME1iUXgwcmVmczQvWU9SZjJhTHExNlpvSUQ5eFFCdmt1TFZrWGtSOHk4WHdqNjBhT29ybG5ZbmdNQjI0MmNaNHplRDlDZ0VwTHc9PQ%3D%3D","name":"rapid_response/warn_documents/2025/Feeney Brothers Excavative LLC (Waterbury) 4-16-2025OCR.pdf","modifiedDate":"2025-07-24T14:30:09+00:00","blobProperties":{"warn_document_date":"2025-04-16","warn_document_received_date":"2025-04-16","affected_company":"Feeney Brothers Excavation, LLC","number_of_impacted_workers":"37","layoff_locations__":"137 East Aurora Street in Waterbury, CT","layoff_dates":"April 25, 2025-July 3 1 , 2025."}},{"blobToken":"cjJqR2M5MHBNbGY5bnkyRFJVbHlYeWpUbHBDQXpVSXVFSFZETU5KS1JVNmRBTHFseUYvckI0TnpUdDc4cVcwWFhKUUUwYktEeUhRV0t2RTVvM1VjSjBPVlhTek5ia2ZuZlRiZW1wQngxZ0FURUpQbDZBaW1VSlVSQ2RmM01JOXV2d0lNYmVDWUNxV01mQlhGRVN2YzJiaC8xa0gxbGp3UDlxcUVrRDA2eFRwbEZxVEZrVFlmcVhMM2JaRmZaZ25pOGxwKzhSS1M0dXYwK3U3ZHo2OVMvdGlNUDZuKzduekZXMUFaN1VGazFTdz0%3D","name":"rapid_response/warn_documents/2025/Block Inc. (Remote) 3-25-2025.pdf","modifiedDate":"2025-06-16T12:47:48+00:00","blobProperties":{"warn_document_date":"2025-03-25","warn_document_received_date":"2025-03-25","affected_company":"Block, Inc","number_of_impacted_workers":"2","layoff_dates":"March 25, 2025","title":"Block, Inc. - WARN Notice"}},{"blobToken":"cjJqR2M5MHBNbGY5bnkyRFJVbHlYeWpUbHBDQXpVSXVFSFZETU5KS1JVNmRBTHFseUYvckI0TnpUdDc4cVcwWFhKUUUwYktEeUhRV0t2RTVvM1VjSjBPVlhTek5ia2ZuZlRiZW1wQngxZ0FURUpQbDZBaW1VSlVSQ2RmM01JOXV2d0lNYmVDWUNxV01mQlhGRVN2YzJTdHpCK0k3bmpFbDFDRlpnY2RLdHhqa1BUTzBzaWwxcWFpVXFaVndMSURpamE1eThwWVUrblNJaHk3N3hhOHMzQ0gxMG5FdE54NUpnZVh0SUYwYTAvc1o5MGNuWGJpdk1qRWxiYzRGY2IzQw%3D%3D","name":"rapid_response/warn_documents/2025/Barnes Group Inc. (Bristol) 3-7-2025.pdf","modifiedDate":"2025-03-25T16:38:09+00:00","blobProperties":{"warn_document_date":"2025-03-07","warn_document_received_date":"2025-03-07","affected_company":"Barnes Group Inc.","number_of_impacted_workers":"28","layoff_locations__":"123 Main Street, Bristol, CT 06010","layoff_dates":"March 31, 2025, June 30, 2025, and September 30, 2025","closing_dates_":"December 31, 2025","union":"No"}},{"blobToken":"cjJqR2M5MHBNbGY5bnkyRFJVbHlYeWpUbHBDQXpVSXVFSFZETU5KS1JVNmRBTHFseUYvckI0TnpUdDc4cVcwWFhKUUUwYktEeUhRV0t2RTVvM1VjSjBPVlhTek5ia2ZuZlRiZW1wQngxZ0FURUpQbDZBaW1VSlVSQ2RmM01JOXV2d0lNYmVDWUNxV01mQlhGRVN2YzJka0NHQ1VqUDY1ZXpRSW4zdmVDdmRvY2o0dWVBSDJWWW9kY05seEgraEFMQWhEVjdOai9EeEQ3OG1uMWhBSWJaOWdIYjNSbTUxZ0RqamhyUG9lVDlOND0%3D","name":"rapid_response/warn_documents/2025/Rheem-Eemax (Waterbury) 2-24-2025.pdf","modifiedDate":"2025-05-01T18:59:08+00:00","blobProperties":{"warn_document_date":"2025-02-24","warn_document_received_date":"2025-02-24","affected_company":"Rheem Manufacturing Company","number_of_impacted_workers":"76","layoff_locations__":"400 Captain Neville  Drive, in the city of Waterbury, Connecticut 06705","layoff_dates":"April 30,  2025. Additional layoffs are scheduled for June 20, 2025 and July 30, 2025"}},{"blobToken":"cjJqR2M5MHBNbGY5bnkyRFJVbHlYeWpUbHBDQXpVSXVFSFZETU5KS1JVNmRBTHFseUYvckI0TnpUdDc4cVcwWFhKUUUwYktEeUhRV0t2RTVvM1VjSjBPVlhTek5ia2ZuZlRiZW1wQngxZ0FURUpQbDZBaW1VSlVSQ2RmM01JOXV2d0lNYmVDWUNxV01mQlhGRVN2YzJjNlNnTGt5bklvZlgrZG1HM3JBdHBYaW04R20zeXE2OSs2U0NRb0pvYVVTc0tjM0NOQnh4K2VsSkFkZnJMbnR6OXM5c0gvOW91L01iOU5PWGt3SDVyND0%3D","name":"rapid_response/warn_documents/2025/CVS Health (Hartford) 2-11-2025.pdf","modifiedDate":"2025-03-20T17:55:20+00:00","blobProperties":{"warn_document_date":"2025-02-11","warn_document_received_date":"2025-02-11","affected_company":"CVS Health","number_of_impacted_workers":"4","layoff_locations__":"151 Farmington Avenue, Hartford, Connecticut","layoff_dates":"April 12, 2025"}},{"blobToken":"cjJqR2M5MHBNbGY5bnkyRFJVbHlYeWpUbHBDQXpVSXVFSFZETU5KS1JVNmRBTHFseUYvckI0TnpUdDc4cVcwWFhKUUUwYktEeUhRV0t2RTVvM1VjSjBPVlhTek5ia2ZuZlRiZW1wQngxZ0FURUpQbDZBaW1VSlVSQ2RmM01JOXV2d0lNYmVDWUNxV01mQlhGRVN2YzJjNlNnTGt5bklvZlgrZG1HM3JBdHBYaW04R20zeXE2OSs2U0NRb0pvYVVTc0tjM0NOQnh4K2VsSkFkZnJMbnR6eUxlNVZROTlUc0RSQTU1WlpqOXVHOD0%3D","name":"rapid_response/warn_documents/2025/CVS Health (Hartford) 2-4-2025.pdf","modifiedDate":"2025-03-20T17:52:55+00:00","blobProperties":{"warn_document_date":"2025-02-04","warn_document_received_date":"2025-02-04","affected_company":"CVS Health","number_of_impacted_workers":"22","layoff_locations__":"151 Farmington Avenue, Hartford, Connecticut","layoff_dates":"June 7, 2025"}},{"blobToken":"cjJqR2M5MHBNbGY5bnkyRFJVbHlYeWpUbHBDQXpVSXVFSFZETU5KS1JVNmRBTHFseUYvckI0TnpUdDc4cVcwWFhKUUUwYktEeUhRV0t2RTVvM1VjSjBPVlhTek5ia2ZuZlRiZW1wQngxZ0FURUpQbDZBaW1VSlVSQ2RmM01JOXV2d0lNYmVDWUNxV01mQlhGRVN2YzJiTjN4ak0xOXNHcjE3dHkvNmExQ0E2U2daOXJ1YzFsdEZrUGRWUTM3UUl6bnYzbXJnZnRhZDJEd1lTTWIzbklsUEJRaWNyM052a3BqRGs0NDlnUFBDUT0%3D","name":"rapid_response/warn_documents/2025/Rex Forge (Plantsville) 2-3-25.pdf","modifiedDate":"2025-05-01T14:58:29+00:00","blobProperties":{"warn_document_date":"2025-02-03","affected_company":"J.J. Ryan Corporation d/b/a Rex Forge","number_of_impacted_workers":"103","layoff_locations__":"Plantsville, CT","layoff_dates":"February 10th, 2025 through February 24, 2025","closing_dates_":"February 24, 2025"}},{"blobToken":"cjJqR2M5MHBNbGY5bnkyRFJVbHlYeWpUbHBDQXpVSXVFSFZETU5KS1JVNmRBTHFseUYvckI0TnpUdDc4cVcwWFhKUUUwYktEeUhRV0t2RTVvM1VjSjBPVlhTek5ia2ZuZlRiZW1wQngxZ0FURUpQbDZBaW1VSlVSQ2RmM01JOXV2d0lNYmVDWUNxV01mQlhGRVN2YzJjNlNnTGt5bklvZlgrZG1HM3JBdHBYaW04R20zeXE2OSs2U0NRb0pvYVVTc0tjM0NOQnh4K2VsSkFkZnJMbnR6NkxvaFRaU3RXMDdGeXBKTDBUNUJCOD0%3D","name":"rapid_response/warn_documents/2025/CVS Health (Hartford) 1-17-2025.pdf","modifiedDate":"2025-03-20T17:47:14+00:00","blobProperties":{"warn_document_date":"2025-01-17","warn_document_received_date":"2025-01-17","affected_company":"CVS Health","number_of_impacted_workers":"13","layoff_locations__":"151 Farmington Avenue, Hartford, Connecticut, /remote/work at home employees","layoff_dates":"March, 2025"}},{"blobToken":"cjJqR2M5MHBNbGY5bnkyRFJVbHlYeWpUbHBDQXpVSXVFSFZETU5KS1JVNmRBTHFseUYvckI0TnpUdDc4cVcwWFhKUUUwYktEeUhRV0t2RTVvM1VjSjBPVlhTek5ia2ZuZlRiZW1wQngxZ0FURUpQbDZBaW1VSlVSQ2RmM01JOXV2d0lNYmVDWUNxV01mQlhGRVN2YzJSMGg4VHJWNFRFZXc0VndjOVdVUGpBd0xTbmpHRHZHOXR1TUNxN1ZocmlpdHpWNlllWVJidzdlU094c1pxTU9kdUtJQnRMNjA1eTJPa3k4VklwWTNlVWlUNTN5VVJiWHQ0ZW9XamRIV01YUw%3D%3D","name":"rapid_response/warn_documents/2024/Countryside Manor (Bristol) 12-23-2024.pdf","modifiedDate":"2025-06-05T13:20:44+00:00","blobProperties":{"title":"Countryside Manor (Bristol) 12-23-2024","warn_document_date":"2024-12-23","warn_document_received_date":"2024-12-24","affected_company":"Countryside Manor of Bristol","number_of_impacted_workers":"178","layoff_locations__":"1660 Stafford ave, Bristol CT 06010","layoff_dates":"March 21, 2025","closing_dates_":"March 21, 2025"}},{"blobToken":"cjJqR2M5MHBNbGY5bnkyRFJVbHlYeWpUbHBDQXpVSXVFSFZETU5KS1JVNmRBTHFseUYvckI0TnpUdDc4cVcwWFhKUUUwYktEeUhRV0t2RTVvM1VjSjBPVlhTek5ia2ZuZlRiZW1wQngxZ0FURUpQbDZBaW1VSlVSQ2RmM01JOXV2d0lNYmVDWUNxV01mQlhGRVN2YzJma3d1U0FhTDllVjN1bHJVejJUd29ZY2ZpeTVYa1pkVmxKaElZalUxejVYZTF4dFZFWVhFcGlSclhRNklKWFE5ZEpDVncvbTVOV3NKN0hYZHBET0JYa3BYZ1dYNzVmTVNibitOUUplc244TjUralpKaDc2VkpIZ1VjTkpaajFFVDQ1Zjk3MkZscGRmUGRxSWdialBFTEU9","name":"rapid_response/warn_documents/2024/Sheriden Woods Health Care Center (Bristol) 12-23-2024.pdf","modifiedDate":"2025-06-05T19:21:46+00:00","blobProperties":{"title":"Sheriden Woods Health Care Center (Bristol) 12-23-2024","warn_document_date":"2024-12-23","warn_document_received_date":"2024-12-24","affected_company":"Sheriden Woods Health Care Center","number_of_impacted_workers":"248","layoff_locations__":"321 Stonecrest Dr, Bristol CT 06010","layoff_dates":"3/22/25","closing_dates_":"3/22/25"}},{"blobToken":"cjJqR2M5MHBNbGY5bnkyRFJVbHlYeWpUbHBDQXpVSXVFSFZETU5KS1JVNmRBTHFseUYvckI0TnpUdDc4cVcwWFhKUUUwYktEeUhRV0t2RTVvM1VjSjBPVlhTek5ia2ZuZlRiZW1wQngxZ0FURUpQbDZBaW1VSlVSQ2RmM01JOXV2d0lNYmVDWUNxV01mQlhGRVN2YzJkQ3BuN3oyZVlodkNPZVFRU2FjOSs3WFFWRkZVS2VvUnFvZ0JXVVJ3WDBTUG8xZWNWcCtNd3ZoamVRTEhvZTZMbHFDeit1dGxpekp1NjlXTE5KL0Y0WT0%3D","name":"rapid_response/warn_documents/2024/CVS Health (Hartford) 12-20-2024.pdf","modifiedDate":"2025-06-05T14:04:24+00:00","blobProperties":{"warn_document_date":"2024-12-20","affected_company":"CVS Health","number_of_impacted_workers":"164","layoff_locations__":"151 Farmington Avenue, Hartford, Connecticut","layoff_dates":"February 15, 2025, through February 28, 2025","closing_dates_":"February 28, 2025"}},{"blobToken":"cjJqR2M5MHBNbGY5bnkyRFJVbHlYeWpUbHBDQXpVSXVFSFZETU5KS1JVNmRBTHFseUYvckI0TnpUdDc4cVcwWFhKUUUwYktEeUhRV0t2RTVvM1VjSjBPVlhTek5ia2ZuZlRiZW1wQngxZ0FURUpQbDZBaW1VSlVSQ2RmM01JOXV2d0lNYmVDWUNxV01mQlhGRVN2YzJkQ3BuN3oyZVlodkNPZVFRU2FjOSs3WFFWRkZVS2VvUnFvZ0JXVVJ3WDBTUG8xZWNWcCtNd3ZoamVRTEhvZTZMaGNhbDFPY2RoelhObjc3SDRpZlh3OD0%3D","name":"rapid_response/warn_documents/2024/CVS Health (Hartford) 11-25-2024.pdf","modifiedDate":"2025-06-05T13:38:33+00:00","blobProperties":{"title":"CVS Health (Hartford) 11-25-2024","warn_document_date":"2024-11-25","affected_company":"CVS Health","number_of_impacted_workers":"42","layoff_locations__":"151 Farmington ave, Hartford CT","layoff_dates":"January 25, 2025 through February 7, 2025","closing_dates_":"2/7/25"}}],"currentPage":1,"totalPages":1}