hash_id,postal_code,company,location,notice_date,effective_date,jobs,is_temporary,is_closure,is_amendment
832441b889714f1648796c0826a4fdd5a591f837225d33d25489ff17,HI,"Apple Store, Royal Hawaiian",,2023-11-17,,,,,False
6ff36fc71eac193e83e6f4d51686c3ad5aab96541cfb5ff328bb98ae,IL,Talis Biomedical Corporation,"1375 W Fulton Market Ste 700  Chicago, IL 60607",2023-11-16,,30,,True,False
cde116333851db790e1cd81429bf1eba4a94c87560a0fcbdf216c8a5,NM,"Cygnus Home Service, LLC d/b/a Yelloh",Albuquerque,2023-10-25,2023-12-15,16,,,False
47be24f9e284f9c7e9525a5c7f5361bdf5de9f2f9d6f4aa47a94cc79,NM,UNM Sandoval Regioinal Medical Center,Rio Rancho,2023-10-30,2024-01-01,641,,,False
4e3fa1bcf96392063f3c7d3933e1a81f64541373422c0ad38629ca33,NM,"Galactic Co., LLC and Galactic Enterprises, LLC",Las Cruces,2023-11-08,2024-01-08,73,,,False
cfe218747859e7ca9b0c7f828b03b7961b5ca29d96d948506fa032b2,NY,"Marin In NYC, LLC d/b/a PRINT. Restaurant and The Press Lounge",,2023-11-17,,,,,False
1ac399c6c6bf226ac691ed5316454ace04aea816ee101bd7bb6aafc5,OH,GXO Logistics,Groveport/Franklin,2023-11-14,2024-01-15,192,,,False
502abe80da45c443d13cb8c7a015bb69076aa95b60efbe6f67e71017,VA,Cygnus Home Service,Bedford,2023-10-25,2023-12-15,9,,True,False
