hash_id,postal_code,company,location,notice_date,effective_date,jobs,is_temporary,is_closure,is_amendment
8234af53cf722088c157d45c40fd03f457e52c91af411bc868badcae,IA,Pitney Bowes,Urbandale,2025-03-12,2025-05-19,168,,True,False
e8ba9bec8d6d3a3030615512215111f9abe34212f27d83a62b060660,IL,American Institutes of Research,"10 S Riverside Plaza, Suite 600  Chicago, IL 60606",2025-03-11,,75,,,False
a30d926776fb18b5189e156163750924d568387b2689671c52a8ecde,IL,Gilster-Mary Lee Corporation,"305 E Washington St  Momence, IL 60954-1615",2025-03-11,,69,,True,False
7283dc3b3c21f2f2535f9abbcccfa322403c6833cd46ae9d5725954a,NY,TL Cannon Management Corp. dba Applebee's,,2025-03-12,,,,,False
0205ea28907fcd0aebab94086ceccdf15d020c03c4118edf2e5ce2cb,NY,"Cold Spring Acquisition, LLC d/b/a Cold Spring Hills Center for Nursing and Rehabilitation",,2025-03-12,,,,,False
