hash_id,postal_code,company,location,notice_date,effective_date,jobs,is_temporary,is_closure,is_amendment
b22bcde764e6979a84f543013a724ea1962d935b9eb36589d134e460,NY,"Presbyterian Home for Central New York, Inc.",Oneida,2025-10-28,2026-01-28,128,False,True,False
842be457239581bfdac81d6a7401a49187c1890265c699823b4a5221,OH,"American Signature, Inc dba Vaule City Furniture",Columbus/Franklin,2025-11-21,2026-01-20,256,,,False
f992544ce1f9b05a5918d8ee9d02f0cb6a5ca283f5fef9199056cac7,TX,"Tyson Foods, Inc. (Amarillo B-Shift Operations",Amarillo,2025-11-26,2026-01-20,1761,,,False
e04b258ed4602b2c31f3d5319b8cf6583af3d0d97ac0b59e4a0eca40,TX,"FedEx Supply Chain Logistics & Electrronics, Inc. (Coppell)",Coppell,2025-11-25,2026-01-29,856,,,False
a959f6bf278676c86b62255ef4021ee60696853aa9a2f54be79bed79,TX,Huntington National Bank,Dallas,2025-11-21,2026-01-19,63,,,False
6e5cb795da6a39640ebbc5ebedb859a991d5ddc68c9a483192400c2d,TX,Wood Group USA Inc.,Freeport,2025-11-18,2025-01-05,180,,,False
